flujo_id,orden,estado_id,descripcion,condicion_entrada,condicion_salida,siguiente_estado,respuesta_id_principal,requiere_repregunta,repregunta_si_falta
Identificador del flujo,Posicion secuencial del estado,Codigo unico del estado,Que ocurre en este estado,Condicion minima para entrar,Condicion para salir al siguiente estado,Estado siguiente esperado,Respuesta principal asociada al estado,Si debe repreguntar cuando falta dato,Texto de repregunta cuando falte informacion
vinculacion_especial_docentes,1,consulta_inicial,Recibe solicitud sobre vinculacion especial,Intent de entrada identificado,Usuario confirma continuidad,explicar_tipo_docente,utter_inicio_vinculacion,No,
vinculacion_especial_docentes,2,explicar_tipo_docente,Explica validacion de docente antiguo/nuevo,Entidad tipo_docente disponible,Usuario pide siguiente paso,explicar_reporte_necesidades,utter_tipo_docente,Si,Que tipo de docente necesitas reportar (HCP/HCH/MTO/TCO)?
vinculacion_especial_docentes,3,explicar_reporte_necesidades,Indica que debe remitir proyecto curricular,Nivel y numero_docentes disponibles,Usuario confirma que tiene datos,explicar_validacion_presupuesto,utter_reporte_necesidades,Si,Cuantos docentes y para que nivel (pregrado/posgrado)?
vinculacion_especial_docentes,4,explicar_validacion_presupuesto,Describe validacion presupuestal y responsable,Presupuesto reportado,Usuario solicita cierre o siguiente paso,explicar_revision_documental,utter_validacion_presupuesto,Si,Cual es el valor presupuestal estimado para este proceso?
vinculacion_especial_docentes,5,explicar_revision_documental,Explica revision de documentos y observaciones,Documentos cargados o estado_documentacion,Usuario confirma comprension,cierre_informativo,utter_revision_documental,Si,En que estado estan los documentos del docente?
vinculacion_especial_docentes,6,cierre_informativo,Cierre del flujo con opciones de derivacion,Flujo completado,Confirmacion final o derivacion,END,utter_cierre_vinculacion,No,
